autor,puntuacion,origen,fecha,texto
Cliente Google 1,4,Google,2026-05-16,"La comida estaba muy buena, aunque el servicio fue un poco lento."
Cliente Google 2,2,Google,2026-05-15,"Tardaron demasiado en atendernos y la mesa no estaba preparada."
Cliente TripAdvisor 1,5,TripAdvisor,2026-05-14,"Excelente atención, platos bien presentados y ambiente muy agradable."
Cliente Instagram 1,3,Instagram,2026-05-13,"El local es bonito y la comida estaba bien, pero faltaba información sobre alérgenos."
Cliente Formulario 1,1,Formulario web,2026-05-12,"El plato llegó frío y no recibimos una explicación clara."
